{
  "schema_version": "simulation_ready_cad_joint_template_v1",
  "kind": "joint",
  "template_id": "joint.rack_pinion_drive",
  "version": "1.0.0",
  "title": "Rack-and-pinion compound joint",
  "category": "compound_joint",
  "goal": "Convert input-shaft rotation into constrained linear output travel through a finite rack-and-pinion mesh.",
  "family": "compound",
  "capability_variants": [
    {
      "variant_id": "drive.rack_pinion",
      "plugin_id": "rack_pinion_v1",
      "mechanism_kind": "rack_pinion",
      "runtime_status": "ACTIVE"
    }
  ],
  "input_wrench_kinds": [
    "torque"
  ],
  "observable_quantities": [
    "pose_6d"
  ],
  "components": [
    "input revolute support",
    "pinion",
    "rack",
    "guided prismatic output"
  ],
  "required_instance_fields": [
    "fixed_body_id",
    "input_body_id",
    "output_body_id",
    "pinion_pitch_radius_m",
    "rack_axis_abs",
    "home_progress_m"
  ],
  "source_bindings": [
    {
      "project_id": "rack_pinion_gate_v1",
      "capsule_id": "rack_pinion_gate_drive",
      "source_status": "PROJECT_CERTIFIED",
      "capsule_path": "simulation_ready_cad_workflow/validation_pipeline/planning_templates/provenance/rack_pinion_gate_v1/capsule.json",
      "capsule_sha256": "9d7aa3eae65da19fce37d66b6d6b3893bac2a27508275a5deb2cdac0b7bd8b76",
      "family_spec_path": "simulation_ready_cad_workflow/validation_pipeline/planning_templates/provenance/rack_pinion_gate_v1/family_spec.json",
      "family_spec_sha256": "675ea17967b3fcd5640d4b88c2eb6127101fdecb5e371d51f3368ef6c770dbae"
    }
  ],
  "constraints": [
    "Rack travel must be measured from the guided output body rather than inferred from pinion angle alone.",
    "Pitch geometry and the signed rotation-to-displacement relation must agree.",
    "Physical support drift, off-axis motion, and mesh error remain bounded."
  ],
  "approval": {
    "status": "APPROVED",
    "approved_by": "user",
    "approved_on": "2026-08-02",
    "basis": "Imported from the completed rack_pinion_gate_v1 project at the user's request."
  }
}
