{
  "schema_version": "simulation_ready_cad_joint_template_v1",
  "kind": "joint",
  "template_id": "joint.closed_revolute_linkage",
  "version": "1.0.0",
  "title": "Closed revolute-linkage compound joint",
  "category": "compound_joint",
  "goal": "Transmit bounded input motion to an output rocker through a geometrically closed chain of finite revolute links.",
  "family": "compound",
  "capability_variants": [
    {
      "variant_id": "profile.wiper_four_bar",
      "plugin_id": "revolute_linkage_v1",
      "mechanism_kind": "revolute_linkage",
      "runtime_status": "ACTIVE"
    },
    {
      "variant_id": "profile.pedal_lid",
      "plugin_id": "revolute_linkage_v1",
      "mechanism_kind": "revolute_linkage",
      "runtime_status": "ACTIVE"
    }
  ],
  "input_wrench_kinds": [
    "force",
    "torque"
  ],
  "observable_quantities": [
    "pose_6d"
  ],
  "components": [
    "ground link",
    "input rocker or crank",
    "coupler",
    "output rocker",
    "four finite revolute supports"
  ],
  "required_instance_fields": [
    "ground_body_id",
    "input_body_id",
    "coupler_body_id",
    "output_body_id",
    "joint_frames",
    "input_actuation_kind",
    "input_point_abs_m",
    "home_output_angle_rad"
  ],
  "source_bindings": [
    {
      "project_id": "four_bar_wiper_v1",
      "capsule_id": "wiper_four_bar_linkage",
      "source_status": "PROJECT_CERTIFIED",
      "capsule_path": "simulation_ready_cad_workflow/validation_pipeline/planning_templates/provenance/four_bar_wiper_v1/capsule.json",
      "capsule_sha256": "7a1aa2b0c741fecce4574462e25c5bb097ec425a99f77ac23d69bb5a3ee5a048",
      "family_spec_path": "simulation_ready_cad_workflow/validation_pipeline/planning_templates/provenance/four_bar_wiper_v1/family_spec.json",
      "family_spec_sha256": "a887a2021a64fbca2586c4fc3c2d9e1caf06836544fe0569ef869eac99f1c29d"
    },
    {
      "project_id": "pedal_trash_can_v1",
      "capsule_id": "pedal_lid_linkage",
      "source_status": "PROJECT_CERTIFIED",
      "capsule_path": "simulation_ready_cad_workflow/validation_pipeline/planning_templates/provenance/pedal_trash_can_v1/capsule.json",
      "capsule_sha256": "4bc301f4da5d3f9f36aa345d8de0d6efd2bfdcfc5ed4f1fc7fd8ba890a4fbbc0",
      "family_spec_path": "simulation_ready_cad_workflow/validation_pipeline/planning_templates/provenance/pedal_trash_can_v1/family_spec.json",
      "family_spec_sha256": "3051c2331da3cb4d6504f9443ae126812cb3324cb4aa8d2e30bcbef98dcf66e4"
    }
  ],
  "constraints": [
    "All pivot centers and link lengths must form the authored closed loop in CAD.",
    "Output motion must arise through the input link and coupler rather than direct output actuation.",
    "The selected profile must preserve its authored input actuation and optional compliant-contact behavior.",
    "The physical branch uses finite supports and contacts while the ideal branch remains comparison-only."
  ],
  "approval": {
    "status": "APPROVED",
    "approved_by": "user",
    "approved_on": "2026-08-02",
    "basis": "Imported and generalized from completed four_bar_wiper_v1 and pedal_trash_can_v1 projects at the user's request."
  }
}
